Task Description,Category,Skill
Generar documentación técnica ,Documentación,Beginner
Preparar materiales entrenamiento  para el proyecto,Documentación,Beginner
Orquestar contenedores  siguiendo los estándares establecidos coordinando con el equipo para la próxima release,Despliegue,Beginner
"como prioridad, publicar versión  siguiendo las mejores prácticas para la próxima release",Despliegue,Beginner
mantener entorno de desarrollo con ansible para herramienta interna,Desarrollo,Advanced
Instrumentar configuración de ambiente utilizando Terraform con documentación adecuada,Desarrollo,Beginner
Documentar procesos  asegurando la calidad del código durante esta quincena,Documentación,Beginner
Tarea: Implementar en producción  con enfoque en performance,Despliegue,Beginner
Tarea: Coordinación interdepartamental ,Reunión,Advanced
Escribir  siguiendo los estánderes establecidos con documentación adecuada,Documentación,Intermediate
Necesito asegurar calidad  coordinando con el equipo para el próximo sprint,Testing,Intermediate
supervisar y documentar  para la entrega del sprint,Revisión,Beginner
"Como prioridad, garantizar calidad  asegurando la calidad del código esta semana",Revisión,Advanced
Necesito configurar dns ,Despliegue,Beginner
establecer objetivos  para el proyecto,Planificación,Beginner
tarea: realizar pruebas seguridad  con documentación adecuada,Testing,Intermediate
Traducir documentación ,Documentación,Intermediate
Tarea: Programar  considerando los requisitos de seguridad,Planificación,Beginner
Sesión de estrategia ,Reunión,Intermediate
"Como parte del sprint, validar API RESTful con Docker esta semana",Desarrollo,Advanced
Compilar método de validación e integrarlo con el sistema existente usando React,Desarrollo,Intermediate
evaluar desempeño  como parte de la iteración actual,Revisión,Intermediate
Redactar  para el proyecto siguiendo las mejores prácticas,Documentación,Beginner
necesito elaborar wireframes material de branding para interfaz de administración,Diseño,Beginner
evaluar y documentar  y realizar pruebas unitarias antes del viernes,Revisión,Beginner
distribuir tareas y documentar  siguiendo las mejores prácticas,Planificación,Advanced
Ajuster cronograma y documentar  con enfoque en performance,Planificación,Advanced
gestionar riesgos  siguiendo los estándares establecidos manteniendo la compatibilidad con versiones anteriores,Planificación,Intermediate
tarea: optimizar suite  con enfoque en performance antes del viernes,Testing,Advanced
Escalar infraestructura  siguiendo los estándares establecidos esta semana,Despliegue,Beginner
"Como prioridad, crear plan trabajo  antes del viernes",Planificación,Beginner
Tarea: Documentar procesos  con enfoque en performance,Documentación,Intermediate
Revisar código módulo de reportes con Kubernetes para Sistema de Gestión,Desarrollo,Intermediate
"Como prioridad, preparar manual  para la entrega del sprint",Documentación,Intermediate
Necesito asegurar mejores prácticas  con enfoque en performance antes del viernes,Revisión,Advanced
Mejorar y optimizar microservicio de inventario para mejor rendimiento en Spring Boot antes del viernes,Desarrollo,Beginner
necesito briefing ,Reunión,Beginner
Escribir manual usuario  siguiendo las mejores prácticas,Documentación,Advanced
"Como prioridad, evaluar arquitectura  durante esta quincena",Revisión,Intermediate
Aplicar principios menús desplegables siguiendo la guía de estilos con Blender asegurando la calidad del código,Diseño,Intermediate
priorizar issues  para el proyecto con documentación adecuada antes del viernes,Testing,Beginner
Tarea: Publicar versión  y realizar pruebas unitarias,Despliegue,Beginner
testear  para la entrega del sprint en los próximos días,Testing,Beginner
Tarea: Gestionar riesgos  con enfoque en performance,Planificación,Advanced
Configurar despliegue  siguiendo los estándares establecidos siguiendo las mejores prácticas,Despliegue,Advanced
debriefing  para el proyecto,Reunión,Advanced
optimizar flujos modales de confirmación que cumpla con estándares de accesibilidad usando webflow con documentación adecuada,Diseño,Beginner
"Como prioridad, workshop  para la entrega del sprint",Reunión,Intermediate
"Como prioridad, analizer resultados  con documentación adecuada antes del viernes",Testing,Intermediate
Asegurar estándares  para el proyecto,Revisión,Intermediate
Necesito implementer controlador de base de datos con PostgreSQL,Desarrollo,Intermediate
Tarea: Analizar resultados  considerando los requisitos de seguridad,Testing,Beginner
"Como prioridad, configurar balanceador  siguiendo las mejores prácticas",Despliegue,Advanced
Tarea: Ejecutar pruebas ,Testing,Beginner
Necesito alinemento  para la próxima release,Reunión,Beginner
Tarea: Crear clase de utilidades para Plataforma E-commerce,Desarrollo,Advanced
Gestionar riesgos  siguiendo los estándares establecidos,Planificación,Advanced
Inspeccionar y documentar  coordinando con el equipo antes del viernes,Revisión,Beginner
validar cumplimiento  siguiendo los estándares establecidos para la entrega del sprint,Revisión,Beginner
necesito testear  para la entrega del sprint antes del viernes,Testing,Intermediate
Necesito hacer deploy  para el próximo sprint,Despliegue,Beginner
Tarea: Ajustar cronograma  asegurando la calidad del código antes del viernes,Planificación,Advanced
preparar reporte  y realizar pruebas unitarias en los próximos días,Documentación,Beginner
"Como prioridad, planificación  manteniendo la compatibilidad con versiones anteriores en los próximos días",Reunión,Advanced
Necesito diseñar interfaz branding consistente para Experiencia Mobile First para la entrega del sprint,Diseño,Intermediate
Balancear carga ,Planificación,Intermediate
Migrar a producción  para el proyecto con documentación adecuada,Despliegue,Intermediate
tarea: asegurar estándares  para el próximo sprint,Revisión,Intermediate
Testeer  siguiendo los estándares establecidos siguiendo las mejores prácticas esta semana,Testing,Intermediate
Necesito realizar release  considerando los requisitos de seguridad antes del viernes,Despliegue,Intermediate
Creer API docs y documentar  para la entrega del sprint antes del viernes,Documentación,Advanced
"Como parte del sprint, migrar extensión de IDE con PostgreSQL en los próximos días",Desarrollo,Beginner
Tarea: Optimizar recursos  para la entrega del sprint esta semana,Planificación,Beginner
terea: verificar requisitos  como parte de la iteración actual,Revisión,Intermediate
diseñar interfaz guía de estilos siguiendo la guía de estilos con principle,Diseño,Beginner
Diseñar landing page conversiva que sea responsive usando lunacy con documentación adecuada,Diseño,Advanced
Ejecutar pruebas integración y documentar ,Testing,Advanced
tarea: validar funcionalidad  para la entrega del sprint esta semana,Testing,Intermediate
necesito hacer testing regresión  asegurando la calidad del código,Testing,Intermediate
Necesito definir hitos  manteniendo la compatibilidad con versiones anteriores para la próxima release,Planificación,Beginner
ejecutar parámetros de conexión e integrarlo con el sistema existente usando python como parte de la iteración actual,Desarrollo,Intermediate
Diseñar imágenes optimizadas que sea responsive usando Krita coordinando con el equipo,Diseño,Beginner
priorizar issues  para el proyecto manteniendo la compatibilidad con versiones anteriores,Testing,Intermediate
Elaborar tutorial  siguiendo los estándares establecidos siguiendo las mejores prácticas antes del viernes,Documentación,Advanced
Sesión  siguiendo los estándares establecidos en los próximos días,Reunión,Intermediate
Prioridad: crear api restful en mysql considerando los requisitos de seguridad como parte de la iteración actual,Desarrollo,Beginner
escribir especificaciones  para el próximo sprint,Documentación,Intermediate
Tarea: Estructurar  como parte de la iteración actual,Planificación,Beginner
Validar api de usuarios en el proyecto sistema de gestión usando angular y realizar pruebas unitarias,Desarrollo,Intermediate
Realizar auditoría y documentar  en los próximos días,Revisión,Beginner
Necesito optimizar recursos  coordinando con el equipo,Planificación,Intermediate
necesito preparar release  coordinando con el equipo esta semana,Despliegue,Advanced
"Como prioridad, escribir manual usuario  con enfoque en performance",Documentación,Intermediate
escribir especificaciones  y realizar pruebas unitarias,Documentación,Beginner
Gestioner tiempo y documentar  considerando los requisitos de seguridad,Planificación,Advanced
necesito agender  coordinando con el equipo para el próximo sprint,Planificación,Beginner
Documentar procesos  para el proyecto siguiendo las mejores prácticas esta semana,Documentación,Advanced
Construir biblioteca de componentes utilizando Redis asegurando la calidad del código esta semana,Desarrollo,Intermediate
Tarea: Balancear carga ,Planificación,Intermediate
necesito validar usabilidad  para la próxima release,Testing,Advanced
Crear guía de estilos gráficos informativos usando Justinmind considerando los requisitos de seguridad esta semana,Diseño,Advanced
"Como prioridad, controlar calidad  coordinando con el equipo antes del viernes",Revisión,Intermediate
"Como prioridad, revisar  manteniendo la compatibilidad con versiones anteriores",Revisión,Advanced
Reportar errores  siguiendo los estándares establecidos con enfoque en performance durante esta quincena,Testing,Intermediate
Priorizar y documentar  considerando los requisitos de seguridad,Planificación,Beginner
Alinemento  siguiendo los estándares establecidos con documentación adecuada como parte de la iteración actual,Reunión,Intermediate
Coordinación interdepertamental  para el proyecto para la entrega del sprint para la próxima release,Reunión,Beginner
Necesito solucioner imagen de aplicación con React asegurando la calidad del código,Desarrollo,Advanced
Iterar sobre diseño sistema de diseño siguiendo la guía de estilos con Axure manteniendo la compatibilidad con versiones anteriores durante esta quincena,Diseño,Advanced
Debriefing  para el proyecto siguiendo las mejores prácticas durante esta quincena,Reunión,Beginner
"Como prioridad, calendarizar  coordinando con el equipo",Planificación,Beginner
Depurar y optimizar parámetros de conexión para mejor rendimiento en GitHub Actions,Desarrollo,Intermediate
Verificar requisitos  siguiendo los estándares establecidos y realizar pruebas unitarias,Revisión,Beginner
Tarea: Testear ,Testing,Advanced
revisar seguridad  siguiendo los estándares establecidos con documentación adecuada,Revisión,Advanced
seguimiento y documentar  con enfoque en performance esta semana,Reunión,Intermediate
Elaborar tutorial  siguiendo los estándares establecidos asegurando la calidad del código antes del viernes,Documentación,Beginner
Analizar resultados  siguiendo los estándares establecidos con documentación adecuada,Testing,Advanced
Optimizar flujos formulario de contacto siguiendo la guía de estilos con Blender con enfoque en performance durante esta quincena,Diseño,Advanced
"como prioridad, revisión de progreso  y realizar pruebas unitarias antes del viernes",Reunión,Intermediate
prioridad: solucionar contenedor docker en chef considerando los requisitos de seguridad como parte de la iteración actual,Desarrollo,Intermediate
"Como prioridad, programar  considerando los requisitos de seguridad para el próximo sprint",Planificación,Intermediate
"Como prioridad, agendar  y realizar pruebas unitarias durante esta quincena",Planificación,Advanced
Definir roadmap  para el proyecto esta semana,Planificación,Beginner
Seleccionar tipografía fotografías profesionales que cumpla con estándares de accesibilidad usando Lunacy y realizar pruebas unitarias,Diseño,Beginner
"Como prioridad, escribir  para la próxima release",Documentación,Intermediate
Configurar servidores  para el proyecto considerando los requisitos de seguridad antes del viernes,Despliegue,Intermediate
Tarea: Evaluar  coordinando con el equipo antes del viernes,Revisión,Intermediate
Estimar y documentar  durante esta quincena,Planificación,Advanced
Prototipar wireframe de navegación usando Justinmind,Diseño,Beginner
verificar implementación  para el proyecto considerando los requisitos de seguridad durante esta quincena,Revisión,Advanced
Testeer con usuarios ilustraciones personalizadas siguiendo la guía de estilos con GIMP,Diseño,Beginner
Actualizar documentación y documentar  para la entrega del sprint esta semana,Documentación,Advanced
Construir y optimizar biblioteca de componentes para mejor rendimiento en Terraform siguiendo las mejores prácticas,Desarrollo,Intermediate
"como prioridad, definir roadmap  con enfoque en performance antes del viernes",Planificación,Advanced
Estimar  para el próximo sprint,Planificación,Intermediate
Retrospectiva  siguiendo los estándares establecidos durante esta quincena,Reunión,Advanced
validar usabilidad  siguiendo los estándares establecidos,Testing,Intermediate
Crear ejemplos  siguiendo los estándares establecidos esta semana,Documentación,Intermediate
Priorizar issues y documentar  siguiendo las mejores prácticas durante esta quincena,Testing,Intermediate
Necesito crear ejemplos  para la entrega del sprint,Documentación,Intermediate
necesito definir ux layout responsivo para portal de autoservicio coordinando con el equipo durante esta quincena,Diseño,Intermediate
Hacer testing regresión  siguiendo los estándares establecidos durante esta quincena,Testing,Beginner
Configurar DNS  coordinando con el equipo,Despliegue,Beginner
Establecer objetivos  para el proyecto con documentación adecuada,Planificación,Beginner
Garantizar calidad  para el proyecto en los próximos días,Revisión,Advanced
"Como prioridad, hacer deploy  considerando los requisitos de seguridad",Despliegue,Intermediate
Realizar auditoría y documentar  para la entrega del sprint en los próximos días,Revisión,Beginner
Analizar resultados y documentar  con documentación adecuada,Testing,Beginner
Tarea: Migrar servicio web SOAP para App Móvil considerando los requisitos de seguridad,Desarrollo,Advanced
Validar funcionalidad  para el proyecto manteniendo la compatibilidad con versiones anteriores en los próximos días,Testing,Beginner
Necesito encuentro ,Reunión,Intermediate
Aplicar principios mockup de alta fidelidad usando Blender considerando los requisitos de seguridad,Diseño,Advanced
Revisar código clase de utilidades e integrarlo con el sistema existente usando flask antes del viernes,Desarrollo,Advanced
preparar manual y documentar  para el próximo sprint,Documentación,Advanced
Auditar y documentar  siguiendo las mejores prácticas para el próximo sprint,Revisión,Intermediate
prioridad: solucionar proceso batch en jenkins manteniendo la compatibilidad con versiones anteriores,Desarrollo,Intermediate
realizar release  siguiendo los estándares establecidos,Despliegue,Beginner
Necesito mejorar usabilidad identidad visual para Nueva Identidad Visual asegurando la calidad del código,Diseño,Beginner
"Como prioridad, automatizar pruebas  esta semana",Testing,Advanced
tarea: administrar clusters  coordinando con el equipo como parte de la iteración actual,Despliegue,Advanced
"Como parte del sprint, ejecutar algoritmo de recomendación con Kubernetes asegurando la calidad del código antes del viernes",Desarrollo,Intermediate
diseñar iconos dashboard administrativo para interfaz de administración con justinmind durante esta quincena,Diseño,Intermediate
Planear y documentar  siguiendo las mejores prácticas,Planificación,Intermediate
Definir hitos  siguiendo los estándares establecidos con enfoque en performance,Planificación,Advanced
prioridad: revisar código api restful en django asegurando la calidad del código,Desarrollo,Intermediate
Diseñar layout sistema de diseño para Sistema de Diseño con Webflow,Diseño,Intermediate
tarea: medir cobertura ,Testing,Intermediate
inspeccionar y documentar ,Revisión,Intermediate
Mejorar usabilidad componentes de UI que cumpla con estándares de accesibilidad usando Cinema 4D para la próxima release,Diseño,Intermediate
Revisar documentación  considerando los requisitos de seguridad,Documentación,Intermediate
Brainstorming  para el proyecto,Reunión,Advanced
Crear WBS  siguiendo los estándares establecidos manteniendo la compatibilidad con versiones anteriores como parte de la iteración actual,Planificación,Advanced
Definir UI sistema de diseño siguiendo la guía de estilos con Proto.io,Diseño,Beginner
Desarrollar método de validación en el proyecto Dashboard Analytics usando Azure,Desarrollo,Intermediate
Diseñar formularios accesibles que sea responsive usando Canva,Diseño,Intermediate
crear mockups sidebar colapsable que cumpla con estándares de accesibilidad usando sketch siguiendo las mejores prácticas,Diseño,Advanced
planificar navegación animaciones microinteractivas para dashboard de analytics con affinity designer coordinando con el equipo en los próximos días,Diseño,Beginner
Tarea: evaluar desempeño  con documentación adecuada como parte de la iteración actual,Revisión,Advanced
solucionar entorno de desarrollo e integrarlo con el sistema existente usando express con enfoque en performance,Desarrollo,Intermediate
Necesito briefing  coordinando con el equipo para la próxima release,Reunión,Intermediate
Inspeccionar  siguiendo las mejores prácticas,Revisión,Advanced
Integrar imagen de aplicación e integrarlo con el sistema existente usando Django durante esta quincena,Desarrollo,Advanced
"como prioridad, seguimiento ",Reunión,Beginner
Desarrollar y optimizar sistema de cache para mejor rendimiento en MySQL,Desarrollo,Beginner
"Como prioridad, configurar dns  considerando los requisitos de seguridad para la próxima release",Despliegue,Beginner
Briefing y documentar ,Reunión,Advanced
tarea: gestionar riesgos  manteniendo la compatibilidad con versiones anteriores,Planificación,Beginner
Briefing y documentar  con enfoque en performance,Reunión,Intermediate
"como prioridad, asignar recursos  asegurando la calidad del código",Planificación,Intermediate
Validar usabilidad y documentar ,Testing,Intermediate
Ejecutar pruebas  siguiendo los estándares establecidos coordinando con el equipo,Testing,Beginner
definir roadmap y documentar  con enfoque en performance,Planificación,Beginner
reunión de cierre y documentar ,Reunión,Advanced
Aplicar principios prototipo interactivo para Sistema de Diseño con Justinmind considerando los requisitos de seguridad,Diseño,Intermediate
Migrar a producción  para el proyecto esta semana,Despliegue,Intermediate
Tarea: Realizar release  durante esta quincena,Despliegue,Beginner
Priorizar issues  y realizar pruebas unitarias,Testing,Beginner
Definir paleta colores paleta de colores siguiendo la guía de estilos con Cinema 4D con enfoque en performance,Diseño,Advanced
Configurar DNS y documentar ,Despliegue,Intermediate
Mejorar framework de pruebas en el proyecto Dashboard Analytics usando Angular coordinando con el equipo antes del viernes,Desarrollo,Beginner
escalar infraestructura  esta semana,Despliegue,Intermediate
configurar servidores  siguiendo los estándares establecidos,Despliegue,Beginner
"como prioridad, documentar procesos  para la entrega del sprint durante esta quincena",Documentación,Intermediate
Adaptar y optimizar módulo de reportes para mejor rendimiento en SQLite para la entrega del sprint,Desarrollo,Intermediate
Garantizar calidad  para el proyecto para la entrega del sprint durante esta quincena,Revisión,Beginner
Programar API de usuarios en el proyecto App Móvil usando Node.js siguiendo las mejores prácticas,Desarrollo,Intermediate
Codificar parámetros de conexión e integrarlo con el sistema existente usando Angular con enfoque en performance,Desarrollo,Intermediate
Tarea: Sincronización técnica  para la entrega del sprint antes del viernes,Reunión,Intermediate
"como prioridad, evaluar  en los próximos días",Revisión,Beginner
Tarea: Sync  durante esta quincena,Reunión,Intermediate
Realizar pruebas unitarias  considerando los requisitos de seguridad,Testing,Advanced
lanzar  para la próxima release,Despliegue,Advanced
"como prioridad, orquestar contenedores ",Despliegue,Advanced
tarea: definir hitos ,Planificación,Intermediate
Optimizar desempeño producción y documentar  con documentación adecuada antes del viernes,Despliegue,Advanced
Priorizar issues  para el proyecto considerando los requisitos de seguridad durante esta quincena,Testing,Intermediate
Definir KPIs ,Planificación,Beginner
Organizar  para el proyecto esta semana,Planificación,Intermediate
necesito alinemento  antes del viernes,Reunión,Beginner
Preparar manual  siguiendo los estándares establecidos para la entrega del sprint esta semana,Documentación,Beginner
planificación ,Reunión,Beginner
elaborar barras de navegación para mejorar la experiencia de usuario usando blender con documentación adecuada,Diseño,Intermediate
"como prioridad, implementar en producción  siguiendo las mejores prácticas esta semana",Despliegue,Advanced
necesito validar usabilidad  con enfoque en performance,Testing,Beginner
estructurar y documentar ,Planificación,Intermediate
revisar servicio web soap con rabbitmq para sistema de gestión,Desarrollo,Intermediate
diseñar tipografía corporativa que sea responsive usando coreldraw con documentación adecuada para la próxima release,Diseño,Advanced
validar cumplimiento  para el proyecto para la entrega del sprint,Revisión,Intermediate
Demo  para la entrega del sprint,Reunión,Advanced
tarea: coordinación interdepartamental  coordinando con el equipo,Reunión,Advanced
asegurar estándares  en los próximos días,Revisión,Advanced
Tarea: Coordinación  durante esta quincena,Reunión,Beginner
tarea: elaborar plan proyecto  considerando los requisitos de seguridad,Planificación,Advanced
Tarea: Validar usabilidad  coordinando con el equipo,Testing,Advanced
Tarea: Validar cumplimiento  considerando los requisitos de seguridad,Revisión,Intermediate
Hacer deploy  con documentación adecuada para la próxima release,Despliegue,Advanced
Reunión  con documentación adecuada,Reunión,Intermediate
"Como prioridad, preparar ambiente producción  asegurando la calidad del código",Despliegue,Beginner
"Como prioridad, documentar procesos  coordinando con el equipo",Documentación,Intermediate
debriefing y documentar ,Reunión,Beginner
Mejorar microservicio de catálogo e integrarlo con el sistema existente usando vue.js coordinando con el equipo para el próximo sprint,Desarrollo,Advanced
tarea: compilar proceso batch para app móvil con documentación adecuada para la próxima release,Desarrollo,Intermediate
Crear guía  asegurando la calidad del código como parte de la iteración actual,Documentación,Beginner
Prioridad: Desplegar utilidad de línea de comandos en Prometheus coordinando con el equipo en los próximos días,Desarrollo,Intermediate
Definir UX landing page conversiva que cumpla con estándares de accesibilidad usando CorelDRAW y realizar pruebas unitarias,Diseño,Beginner
necesito optimizar desempeño producción  antes del viernes,Despliegue,Intermediate
calendarizar  siguiendo los estándares establecidos,Planificación,Beginner
terea: configurar dns ,Despliegue,Intermediate
migrar a producción  siguiendo los estándares establecidos para el próximo sprint,Despliegue,Intermediate
necesito definir kpis  para la entrega del sprint,Planificación,Advanced
Sync  pera el proyecto manteniendo la compatibilidad con versiones anteriores,Reunión,Beginner
Necesito realizar qa ,Testing,Advanced
Controlar calidad  y realizar pruebas unitarias durante esta quincena,Revisión,Intermediate
tarea: preparar reporte  considerando los requisitos de seguridad como parte de la iteración actual,Documentación,Advanced
definir paleta colores branding consistente para nueva identidad visual con cinema 4d y realizar pruebas unitarias esta semana,Diseño,Intermediate
terea: monitorear utilidad de línea de comandos para plataforma e-commerce con enfoque en performance como parte de la iteración actual,Desarrollo,Beginner
Medir cobertura y documentar  siguiendo las mejores prácticas,Testing,Advanced
gestionar riesgos  siguiendo los estándares establecidos,Planificación,Intermediate
validar funcionalidad  para el proyecto,Testing,Advanced
Administrar clusters  para el proyecto como parte de la iteración actual,Despliegue,Advanced
instrumentar middleware de autenticación en el proyecto ganttflow usando puppet,Desarrollo,Beginner
Asegurar estándares  en los próximos días,Revisión,Beginner
"Como prioridad, hacer testing regresión  y realizar pruebas unitarias durante esta quincena",Testing,Beginner
Preparar materiales entrenamiento  para el proyecto coordinando con el equipo esta semana,Documentación,Advanced
Crear mockups componentes de UI para App Móvil Nativa con Affinity Designer asegurando la calidad del código,Diseño,Intermediate
Crear paleta de colores utilizando Sketch para el proyecto Rediseño de Plataforma,Diseño,Advanced
Configurar balanceador  para el proyecto considerando los requisitos de seguridad antes del viernes,Despliegue,Advanced
Estructurar  para el proyecto siguiendo las mejores prácticas esta semana,Planificación,Beginner
escribir  siguiendo los estándares establecidos siguiendo las mejores prácticas para el próximo sprint,Documentación,Advanced
Sesión de estrategia  siguiendo los estánderes establecidos para la entrega del sprint,Reunión,Intermediate
"Como prioridad, escalar infraestructura ",Despliegue,Advanced
tarea: automatizar pruebas  con enfoque en performance durante esta quincena,Testing,Advanced
