Task Description,Category,Skill
crear guía de estilos landing page conversiva usando gimp,Diseño,Intermediate
Verificar requisitos  con documentación adecuada,Revisión,Intermediate
Necesito definir ux interfaz de usuario para Dashboard de Analytics para la entrega del sprint para el próximo sprint,Diseño,Intermediate
Publicar  siguiendo los estándares establecidos,Despliegue,Beginner
tarea: gestionar tiempo  manteniendo la compatibilidad con versiones anteriores,Planificación,Beginner
necesito compilar componente ui con kafka coordinando con el equipo esta semana,Desarrollo,Beginner
probar  siguiendo los estándares establecidos asegurando la calidad del código,Testing,Beginner
Validar componente UI en el proyecto GanttFlow usando Docker durante esta quincena,Desarrollo,Intermediate
Crear plugin de navegador utilizando nginx con enfoque en performance,Desarrollo,Intermediate
Maquetar formularios accesibles que cumpla con estándares de accesibilidad usando Krita con documentación adecuada para la próxima release,Diseño,Advanced
Analizar código y documentar  manteniendo la compatibilidad con versiones anteriores,Revisión,Beginner
preparar ambiente producción  para el proyecto considerando los requisitos de seguridad esta semana,Despliegue,Advanced
"Como prioridad, crear ejemplos ",Documentación,Intermediate
Escribir manual usuario  siguiendo los estándares establecidos,Documentación,Beginner
Configurar DNS  para el proyecto,Despliegue,Beginner
"como prioridad, revisar documentación  manteniendo la compatibilidad con versiones anteriores",Revisión,Intermediate
necesito preparar reporte  antes del viernes,Documentación,Beginner
Ejecutar módulo de reportes en el proyecto Herramienta Interna usando Chef con enfoque en performance en los próximos días,Desarrollo,Intermediate
coordinar con desarrollo branding consistente usando framer para la entrega del sprint,Diseño,Beginner
"Como parte del sprint, revisar código parámetros de conexión con Chef considerando los requisitos de seguridad",Desarrollo,Advanced
necesito escribir especificaciones  para la entrega del sprint,Documentación,Advanced
automatizar pruebas  siguiendo los estándares establecidos durante esta quincena,Testing,Advanced
Tarea: realizar release ,Despliegue,Advanced
Probar rendimiento  siguiendo los estándares establecidos y realizar pruebas unitarias,Testing,Advanced
crear wbs  siguiendo los estándares establecidos con documentación adecuada,Planificación,Beginner
Tarea: Actualizar variables de entorno para Plataforma Educativa considerando los requisitos de seguridad,Desarrollo,Beginner
Tarea: Configurar despliegue  siguiendo las mejores prácticas antes del viernes,Despliegue,Beginner
Asegurar mejores prácticas y documentar  considerando los requisitos de seguridad,Revisión,Beginner
"Como prioridad, coordinación  siguiendo las mejores prácticas",Reunión,Beginner
necesito elaborar tutorial ,Documentación,Advanced
Tarea: Coordinación interdepartamental  coordinando con el equipo en los próximos días,Reunión,Intermediate
Preparar manual y documentar  con documentación adecuada esta semana,Documentación,Beginner
Necesito publicar versión  con enfoque en performance,Despliegue,Beginner
Sincronización técnica  para el proyecto con enfoque en performance,Reunión,Advanced
reunión de kickoff  siguiendo los estándares establecidos,Reunión,Beginner
Necesito ejecutar componente ui con kafka,Desarrollo,Beginner
Diseñar iconos dashboard administrativo siguiendo la guía de estilos con Balsamiq siguiendo las mejores prácticas en los próximos días,Diseño,Intermediate
Realizar QA  para el proyecto considerando los requisitos de seguridad,Testing,Beginner
"Como prioridad, planificación de sprint  considerando los requisitos de seguridad en los próximos días",Reunión,Intermediate
necesito configurar dns  esta semana,Despliegue,Beginner
Revisión de progreso  para el proyecto como parte de la iteración actual,Reunión,Beginner
necesito redactar procedimientos  coordinando con el equipo,Documentación,Beginner
Revisar documentación ,Revisión,Beginner
Crear sidebar colapsable utilizando cinema 4d para el proyecto app móvil nativa asegurando la calidad del código,Diseño,Beginner
Aprobar cambios  para el proyecto,Revisión,Advanced
desplegar  para el proyecto en los próximos días,Despliegue,Beginner
Ejecuter tests  para el proyecto,Testing,Advanced
desarrollar script de despliegue en el proyecto plataforma educativa usando python,Desarrollo,Beginner
Instrumentar módulo de analytics e integrarlo con el sistema existente usando terraform y realizar pruebas unitarias como parte de la iteración actual,Desarrollo,Beginner
Validar cumplimiento  siguiendo los estándares establecidos,Revisión,Beginner
Elaborar tutorial y documentar  coordinando con el equipo como parte de la iteración actual,Documentación,Advanced
Publicar  siguiendo los estándares establecidos con documentación adecuada como parte de la iteración actual,Despliegue,Advanced
codificar paquete npm en el proyecto app móvil usando azure para el próximo sprint,Desarrollo,Advanced
Probar rendimiento  para el proyecto durante esta quincena,Testing,Intermediate
diseñar layout panel de control usando adobe xd para la entrega del sprint para el próximo sprint,Diseño,Beginner
Crear paleta de colores utilizando Axure para el proyecto Nueva Identidad Visual esta semana,Diseño,Beginner
"como prioridad, workshop  esta semana",Reunión,Intermediate
Traducir documentación  siguiendo los estándares establecidos esta semana,Documentación,Beginner
Necesito evaluar desempeño ,Revisión,Advanced
automatizar despliegue  para el proyecto con enfoque en performance,Despliegue,Beginner
Analizer código y documentar ,Revisión,Beginner
Necesito coordinar con desarrollo paleta de colores para Experiencia Mobile First manteniendo la compatibilidad con versiones anteriores durante esta quincena,Diseño,Beginner
Ajuster cronograma  siguiendo los estándares establecidos,Planificación,Advanced
revisar pull request  siguiendo los estándares establecidos considerando los requisitos de seguridad,Revisión,Advanced
Workshop  en los próximos días,Reunión,Beginner
Tarea: Medir cobertura  asegurando la calidad del código,Testing,Beginner
Realizer release  para el proyecto antes del viernes,Despliegue,Advanced
Diseñar interfaz material de branding para Interfaz de Administración con Affinity Designer siguiendo las mejores prácticas,Diseño,Beginner
Medir cobertura  siguiendo los estándares establecidos siguiendo las mejores prácticas,Testing,Beginner
Validar framework de pruebas con Node.js para Sistema de Gestión para la entrega del sprint,Desarrollo,Advanced
"Como prioridad, actualizar documentación  y realizar pruebas unitarias",Documentación,Intermediate
"como prioridad, verificar requisitos ",Revisión,Advanced
Hacer code review  para el proyecto como parte de la iteración actual,Revisión,Advanced
Instrumentar orquestación Kubernetes e integrarlo con el sistema existente usando Azure manteniendo la compatibilidad con versiones anteriores,Desarrollo,Beginner
diseñar página de inicio que sea responsive usando cinema 4d considerando los requisitos de seguridad,Diseño,Advanced
Necesito asegurar mejores prácticas ,Revisión,Advanced
Necesito escalar infraestructura  durante esta quincena,Despliegue,Advanced
Tarea: Preparar manual  manteniendo la compatibilidad con versiones anteriores durante esta quincena,Documentación,Advanced
Prioridad: Extender paquete NPM en Kubernetes para la entrega del sprint para la próxima release,Desarrollo,Intermediate
validar funcionalidad  para el proyecto para la entrega del sprint en los próximos días,Testing,Intermediate
balancear carga  siguiendo los estándares establecidos con enfoque en performance como parte de la iteración actual,Planificación,Advanced
diseñar panel de control siguiendo la guía de estilos con axure con documentación adecuada,Diseño,Beginner
Necesito crear guía  siguiendo las mejores prácticas en los próximos días,Documentación,Beginner
Mejorar usabilidad dashboard administrativo que cumpla con estándares de accesibilidad usando Illustrator para la entrega del sprint,Diseño,Beginner
Garantizar calidad  siguiendo los estándares establecidos coordinando con el equipo para la próxima release,Revisión,Advanced
Crear landing page conversiva utilizando Zeplin para el proyecto Nueva Identidad Visual manteniendo la compatibilidad con versiones anteriores,Diseño,Beginner
tarea: configurar despliegue  durante esta quincena,Despliegue,Beginner
reportar errores  manteniendo la compatibilidad con versiones anteriores como parte de la iteración actual,Testing,Intermediate
Briefing y documentar ,Reunión,Beginner
planear y documentar  manteniendo la compatibilidad con versiones anteriores,Planificación,Advanced
escribir especificaciones  para el proyecto como parte de la iteración actual,Documentación,Intermediate
Planificación de sprint  para el proyecto asegurando la calidad del código,Reunión,Intermediate
Asegurer mejores prácticas  siguiendo los estándares establecidos con documentación adecuada,Revisión,Beginner
Diseñar identidad visual que sea responsive usando Zeplin asegurando la calidad del código,Diseño,Beginner
Necesito realizar qa  con enfoque en performance,Testing,Intermediate
"como prioridad, escribir especificaciones ",Documentación,Advanced
documentar  para el proyecto considerando los requisitos de seguridad,Documentación,Advanced
Monitorizar producción y documentar  esta semana,Despliegue,Advanced
Realizar pruebas unitarias  coordinando con el equipo,Testing,Intermediate
Ejecutar microservicio de inventario con GraphQL para Sistema de Reportes siguiendo las mejores prácticas,Desarrollo,Intermediate
Depurer y optimizar paquete NPM para mejor rendimiento en Angular,Desarrollo,Advanced
Asignar recursos  para el proyecto con enfoque en performance,Planificación,Advanced
Tarea: Reunión de cierre  con documentación adecuada,Reunión,Intermediate
optimizar proceso batch con aws para api gateway durante esta quincena,Desarrollo,Beginner
necesito secuenciar  coordinando con el equipo,Planificación,Intermediate
prioridad: ejecutar servicio web soap en prometheus y realizar pruebas unitarias,Desarrollo,Advanced
codificar paquete npm utilizando chef esta semana,Desarrollo,Beginner
necesito programar endpoint de pagos con docker en los próximos días,Desarrollo,Intermediate
Revisar documentación  siguiendo los estándares establecidos asegurando la calidad del código antes del viernes,Revisión,Beginner
"Como prioridad, verificar requisitos  para la entrega del sprint",Revisión,Advanced
Evaluar y documentar  siguiendo las mejores prácticas,Revisión,Beginner
necesito ejecutar tests ,Testing,Intermediate
Necesito preparar release  y realizar pruebas unitarias,Despliegue,Advanced
Realizar pruebas unitarias y documentar  considerando los requisitos de seguridad,Testing,Beginner
crear guía y documentar  y realizar pruebas unitarias,Documentación,Intermediate
monitorizar producción y documentar  asegurando la calidad del código durante esta quincena,Despliegue,Advanced
Necesito testear con usuarios layout responsivo para Dashboard de Analytics y realizar pruebas unitarias,Diseño,Intermediate
Necesito crear help center  para la entrega del sprint,Documentación,Beginner
Evaluar accesibilidad íconos personalizados siguiendo la guía de estilos con Krita,Diseño,Advanced
"Como prioridad, inspeccionar ",Revisión,Intermediate
realizar qa y documentar  considerando los requisitos de seguridad en los próximos días,Testing,Advanced
reunión de cierre y documentar  para la entrega del sprint como parte de la iteración actual,Reunión,Beginner
Validar funcionalidad y documentar ,Testing,Beginner
Tarea: Balancear carga  con documentación adecuada,Planificación,Beginner
configurar balanceador  para el proyecto manteniendo la compatibilidad con versiones anteriores,Despliegue,Intermediate
necesito elaborar plan proyecto  con enfoque en performance,Planificación,Beginner
Automatizar pruebas  siguiendo los estándares establecidos con enfoque en performance para el próximo sprint,Testing,Beginner
desplegar y documentar  esta semana,Despliegue,Advanced
Diseñar sistema de navegación que sea responsive usando Proto.io y realizar pruebas unitarias,Diseño,Intermediate
documentar  siguiendo los estándares establecidos,Documentación,Intermediate
Planificar y documentar ,Planificación,Beginner
Configurar DNS y documentar  antes del viernes,Despliegue,Intermediate
retrospectiva  para el proyecto y realizar pruebas unitarias,Reunión,Advanced
"Como prioridad, ajustar cronograma  y realizar pruebas unitarias",Planificación,Intermediate
Necesito realizar pruebas unitarias ,Testing,Intermediate
Necesito revisión  para la entrega del sprint,Reunión,Beginner
Hacer code review y documenter  coordinando con el equipo como parte de la iteración actual,Revisión,Intermediate
"Como prioridad, evaluar  con documentación adecuada",Revisión,Intermediate
Diseñar formulario de contacto que sea responsive usando GIMP con documentación adecuada esta semana,Diseño,Beginner
Analizar resultados y documentar  y realizar pruebas unitarias,Testing,Intermediate
Tarea: presentación  durante esta quincena,Reunión,Intermediate
Organizar wiki y documentar  manteniendo la compatibilidad con versiones anteriores antes del viernes,Documentación,Intermediate
Documentar procesos y documentar  con enfoque en performance,Documentación,Advanced
Rediseñar tipografía corporativa para Portal de Autoservicio con Adobe XD con documentación adecuada como parte de la iteración actual,Diseño,Beginner
Refactorizar librería de gráficos utilizando Linux considerando los requisitos de seguridad,Desarrollo,Advanced
Monitorear y optimizar parámetros de conexión para mejor rendimiento en Elasticsearch manteniendo la compatibilidad con versiones anteriores para el próximo sprint,Desarrollo,Intermediate
"Como prioridad, planificación ",Reunión,Beginner
Tarea: Preparar materiales entrenamiento  con enfoque en performance,Documentación,Beginner
"Como prioridad, junta  y realizar pruebas unitarias",Reunión,Intermediate
Necesito hacer code review ,Revisión,Intermediate
Verificar bugs y documentar ,Testing,Intermediate
Junta  para el proyecto,Reunión,Advanced
Tarea: Compilar función lambda para Plataforma Educativa en los próximos días,Desarrollo,Beginner
"Como prioridad, sincronización técnica  durante esta quincena",Reunión,Intermediate
"Como prioridad, evaluar desempeño  siguiendo las mejores prácticas antes del viernes",Revisión,Beginner
Tarea: Asegurar mejores prácticas ,Revisión,Intermediate
Generar documentación técnica  considerando los requisitos de seguridad antes del viernes,Documentación,Beginner
Controlar calidad  para el proyecto durante esta quincena,Revisión,Beginner
distribuir tareas y documentar  manteniendo la compatibilidad con versiones anteriores,Planificación,Intermediate
Tarea: Planificación de sprint  para la entrega del sprint,Reunión,Beginner
evaluar arquitectura  con documentación adecuada,Revisión,Beginner
preparar ambiente producción  para la próxima release,Despliegue,Beginner
Encuentro  pera el proyecto,Reunión,Advanced
Necesito planificación de sprint  y realizar pruebas unitarias esta semana,Reunión,Advanced
Extender y optimizar servicio web SOAP para mejor rendimiento en Apache,Desarrollo,Intermediate
"Como prioridad, orquestar contenedores  en los próximos días",Despliegue,Beginner
crear guía  siguiendo los estándares establecidos considerando los requisitos de seguridad esta semana,Documentación,Advanced
Coordinación  para el proyecto en los próximos días,Reunión,Advanced
Corregir endpoint de pagos en el proyecto App Móvil usando Elasticsearch siguiendo las mejores prácticas,Desarrollo,Beginner
escribir manual usuario y documentar  considerando los requisitos de seguridad esta semana,Documentación,Intermediate
Necesito crear guía  con documentación adecuada,Documentación,Intermediate
Instrumentar plugin de navegador utilizando Node.js,Desarrollo,Intermediate
"Como prioridad, publicar  y realizar pruebas unitarias en los próximos días",Despliegue,Intermediate
prioridad: compilar herramienta de desarrollo en github actions con enfoque en performance,Desarrollo,Intermediate
"como prioridad, secuenciar  en los próximos días",Planificación,Advanced
Hacer testing regresión  para el proyecto manteniendo la compatibilidad con versiones anteriores,Testing,Advanced
necesito distribuir tareas  siguiendo las mejores prácticas,Planificación,Intermediate
tarea: crear utilidad de backup para sistema de reportes considerando los requisitos de seguridad para la próxima release,Desarrollo,Intermediate
Seguimiento  para el proyecto con enfoque en performance,Reunión,Intermediate
Revisar  para el proyecto asegurando la calidad del código como parte de la iteración actual,Revisión,Intermediate
sincronización técnica y documentar  siguiendo las mejores prácticas esta semana,Reunión,Intermediate
Crear ejemplos y documentar  durante esta quincena,Documentación,Intermediate
Tarea: Configurar DNS  considerando los requisitos de seguridad antes del viernes,Despliegue,Beginner
Documentar y documentar ,Documentación,Advanced
Necesito asegurar estándares  coordinando con el equipo para la próxima release,Revisión,Intermediate
"Como prioridad, configurar dns  para la entrega del sprint",Despliegue,Intermediate
Inspeccionar y documentar  asegurando la calidad del código antes del viernes,Revisión,Beginner
Debriefing  para el proyecto considerando los requisitos de seguridad,Reunión,Intermediate
diseñar experiencia de usuario que sea responsive usando krita coordinando con el equipo durante esta quincena,Diseño,Beginner
Escribir manual usuario y documentar  con enfoque en performance,Documentación,Beginner
Reunión  y realizar pruebas unitarias,Reunión,Beginner
aprobar cambios  manteniendo la compatibilidad con versiones anteriores para la próxima release,Revisión,Advanced
hacer deploy  manteniendo la compatibilidad con versiones anteriores,Despliegue,Beginner
Necesito realizar pruebas seguridad  manteniendo la compatibilidad con versiones anteriores,Testing,Intermediate
Escribir instrucciones  siguiendo los estándares establecidos para la entrega del sprint como parte de la iteración actual,Documentación,Advanced
preparar materiales entrenamiento  para la entrega del sprint antes del viernes,Documentación,Intermediate
"como prioridad, lanzar  con documentación adecuada",Despliegue,Advanced
Necesito reunión de kickoff  para la entrega del sprint,Reunión,Beginner
Tarea: Extender controlador de base de datos para Plataforma Educativa con documentación adecuada en los próximos días,Desarrollo,Beginner
"Como parte del sprint, optimizar biblioteca de componentes con Redis",Desarrollo,Intermediate
junta  como parte de la iteración actual,Reunión,Beginner
Automatizar despliegue  en los próximos días,Despliegue,Advanced
Medir cobertura  para el próximo sprint,Testing,Beginner
Implementar en producción  como parte de la iteración actual,Despliegue,Beginner
Definir roadmap  para la entrega del sprint,Planificación,Beginner
Necesito automatizar pruebas  para la entrega del sprint antes del viernes,Testing,Intermediate
Integrar microservicio de inventario en el proyecto API Gateway usando SQLite coordinando con el equipo,Desarrollo,Intermediate
inspeccionar  y realizar pruebas unitarias para la próxima release,Revisión,Intermediate
Necesito hacer deploy  para la entrega del sprint,Despliegue,Advanced
Verificer bugs  siguiendo los estándares establecidos con documentación adecuada esta semana,Testing,Beginner
Indexar contenidos y documentar  con enfoque en performance,Documentación,Beginner
"Como prioridad, orquestar contenedores  siguiendo las mejores prácticas",Despliegue,Intermediate
"Como prioridad, calendarizar  antes del viernes",Planificación,Intermediate
planificación  y realizar pruebas unitarias durante esta quincena,Reunión,Beginner
Redactar  con documentación adecuada para el próximo sprint,Documentación,Beginner
Prioridad: Probar middleware de autenticación en PostgreSQL asegurando la calidad del código,Desarrollo,Intermediate
Terea: Planear  antes del viernes,Planificación,Beginner
Tarea: Optimizar recursos ,Planificación,Intermediate
coordinar con desarrollo imágenes optimizadas usando balsamiq manteniendo la compatibilidad con versiones anteriores como parte de la iteración actual,Diseño,Advanced
Automatizar despliegue y documentar  para el próximo sprint,Despliegue,Beginner
Iterar sobre diseño branding consistente usando Zeplin y realizar pruebas unitarias para el próximo sprint,Diseño,Advanced
Tarea: Definir KPIs ,Planificación,Beginner
Alinemento  para el proyecto asegurando la calidad del código esta semana,Reunión,Advanced
Tarea: Crear guía ,Documentación,Intermediate
Tarea: Ejecutar pruebas carga  con enfoque en performance esta semana,Testing,Beginner
"Como prioridad, gestionar riesgos ",Planificación,Beginner
Tarea: Implementar en producción  considerando los requisitos de seguridad,Despliegue,Intermediate
"como prioridad, ejecutar tests  para la próxima release",Testing,Intermediate
Tarea: Presentación  asegurando la calidad del código en los próximos días,Reunión,Advanced
Crear help center  siguiendo los estándares establecidos con enfoque en performance,Documentación,Intermediate
"Como prioridad, realizar pruebas seguridad ",Testing,Advanced
Garantizar calidad  para el proyecto,Revisión,Advanced
Validar  para el proyecto manteniendo la compatibilidad con versiones anteriores,Testing,Beginner
Sync  para el proyecto con documentación adecuada,Reunión,Intermediate
Revisar herramienta de desarrollo en el proyecto Dashboard Analytics usando Windows Server y realizar pruebas unitarias para la próxima release,Desarrollo,Beginner
automatizar endpoint de pagos e integrarlo con el sistema existente usando flask con enfoque en performance en los próximos días,Desarrollo,Beginner
escribir  siguiendo los estándares establecidos manteniendo la compatibilidad con versiones anteriores,Documentación,Beginner
Crear guía  para el proyecto,Documentación,Beginner
Tarea: Desplegar servicio de notificaciones para Herramienta Interna durante esta quincena,Desarrollo,Advanced
Tarea: Traducir documentación  durante esta quincena,Documentación,Beginner
Redactar y documentar  con documentación adecuada,Documentación,Advanced
Realizar auditoría  para el proyecto siguiendo las mejores prácticas,Revisión,Advanced
Planear  asegurando la calidad del código,Planificación,Intermediate
Monitorizar producción  manteniendo la compatibilidad con versiones anteriores esta semana,Despliegue,Intermediate
"Como prioridad, orquestar contenedores ",Despliegue,Intermediate
Iterar sobre diseño landing page conversiva usando Principle asegurando la calidad del código antes del viernes,Diseño,Intermediate
Necesito validar calidad  considerando los requisitos de seguridad,Revisión,Beginner
necesito migrar microservicio de catálogo con kubernetes manteniendo la compatibilidad con versiones anteriores,Desarrollo,Beginner
"Como prioridad, elaborar plan proyecto  antes del viernes",Planificación,Advanced
tarea: construir endpoint graphql para herramienta interna,Desarrollo,Advanced
traducir documentación  considerando los requisitos de seguridad,Documentación,Advanced
planificer navegación ilustraciones personalizadas para dashboard de analytics con webflow como parte de la iteración actual,Diseño,Beginner
Probar  para el proyecto siguiendo las mejores prácticas en los próximos días,Testing,Advanced
Configurar dns  siguiendo los estándares establecidos con documentación adecuada,Despliegue,Advanced
Alinemento  siguiendo los estándares establecidos y realizar pruebas unitarias antes del viernes,Reunión,Advanced
Tarea: Verificar requisitos  siguiendo las mejores prácticas para la próxima release,Revisión,Beginner
Tarea: Estimar  siguiendo las mejores prácticas en los próximos días,Planificación,Beginner
"como prioridad, verificar  y realizar pruebas unitarias esta semana",Testing,Intermediate
Tarea: Orquestar contenedores  siguiendo las mejores prácticas,Despliegue,Advanced
necesito desplegar  para la próxima release,Despliegue,Intermediate
diseñar wireframe de navegación que sea responsive usando krita para la entrega del sprint como parte de la iteración actual,Diseño,Advanced
"Como parte del sprint, implementar endpoint de pagos con React considerando los requisitos de seguridad durante esta quincena",Desarrollo,Advanced
escribir ,Documentación,Intermediate
terea: reunión ,Reunión,Advanced
optimizar suite y documentar  y realizar pruebas unitarias,Testing,Beginner
tarea: calendarizar  como parte de la iteración actual,Planificación,Intermediate
Evaluar desempeño  siguiendo los estándares establecidos,Revisión,Advanced
Realizar release  siguiendo los estándares establecidos esta semana,Despliegue,Advanced
"Como prioridad, lanzar actualización ",Despliegue,Intermediate
distribuir tareas ,Planificación,Intermediate
Codificar componente UI en el proyecto Plataforma E-commerce usando Angular considerando los requisitos de seguridad en los próximos días,Desarrollo,Intermediate
"Como prioridad, controlar calidad  con documentación adecuada",Revisión,Intermediate
Validar  esta semana,Testing,Advanced
retrospectiva  para el proyecto para el próximo sprint,Reunión,Intermediate
Standup  siguiendo los estándares establecidos considerando los requisitos de seguridad antes del viernes,Reunión,Beginner
revisar código imagen de aplicación en el proyecto api gateway usando node.js,Desarrollo,Intermediate
