Task Description,Category,Skill
Prioridad: Crear función de autenticación en AWS y realizar pruebas unitarias,Desarrollo,Intermediate
necesito prototipar layout responsivo para experiencia mobile first durante esta quincena,Diseño,Beginner
agendar  siguiendo los estándares establecidos con documentación adecuada,Planificación,Beginner
Necesito revisar controlador de base de datos con RabbitMQ y realizar pruebas unitarias,Desarrollo,Intermediate
Tarea: Sincronización técnica  siguiendo las mejores prácticas,Reunión,Beginner
Estimar y documentar  manteniendo la compatibilidad con versiones anteriores para el próximo sprint,Planificación,Intermediate
"Como prioridad, ejecutar tests  considerando los requisitos de seguridad",Testing,Intermediate
Automatizar despliegue  siguiendo los estándares establecidos para la entrega del sprint,Despliegue,Advanced
necesito documentar procesos ,Documentación,Advanced
tarea: crear plan trabajo  antes del viernes,Planificación,Beginner
tarea: preparar manual  considerando los requisitos de seguridad para el próximo sprint,Documentación,Beginner
briefing  para el proyecto siguiendo las mejores prácticas,Reunión,Intermediate
Calendarizar  siguiendo los estándares establecidos con documentación adecuada,Planificación,Intermediate
Hacer testing regresión  durante esta quincena,Testing,Beginner
Configurar DNS  para el proyecto como parte de la iteración actual,Despliegue,Beginner
"como prioridad, probar rendimiento  con enfoque en performance",Testing,Beginner
Necesito debriefing  asegurando la calidad del código,Reunión,Beginner
Diseñar landing page conversiva que sea responsive usando Photoshop,Diseño,Intermediate
Probar rendimiento  para el proyecto,Testing,Beginner
Publicar versión  para el proyecto para la entrega del sprint,Despliegue,Beginner
"Como prioridad, preparar reporte  con enfoque en performance",Documentación,Advanced
Evaluar arquitectura  para el proyecto manteniendo la compatibilidad con versiones anteriores,Revisión,Intermediate
Tarea: Elaborar plan proyecto  manteniendo la compatibilidad con versiones anteriores,Planificación,Beginner
Gestionar configuración ,Despliegue,Intermediate
terea: revisión de progreso  con documentación adecuada como parte de la iteración actual,Reunión,Intermediate
"Como prioridad, analizar código  considerando los requisitos de seguridad",Revisión,Advanced
preparar materiales entrenamiento  y realizar pruebas unitarias para el próximo sprint,Documentación,Beginner
validar usabilidad y documentar ,Testing,Intermediate
"como prioridad, sync  considerando los requisitos de seguridad en los próximos días",Reunión,Intermediate
Diseñar layout flujo de usuario para Sistema de Diseño con Marvel con documentación adecuada,Diseño,Intermediate
Crear guía  siguiendo los estándares establecidos manteniendo la compatibilidad con versiones anteriores,Documentación,Beginner
publicar versión y documentar  durante esta quincena,Despliegue,Advanced
preparar release  para el proyecto,Despliegue,Intermediate
Implementar CDN  para el proyecto con enfoque en performance,Despliegue,Intermediate
Encuentro  siguiendo los estándares establecidos siguiendo las mejores prácticas para la próxima release,Reunión,Intermediate
"Como prioridad, revisar pull request ",Revisión,Beginner
Verificar bugs  coordinando con el equipo,Testing,Beginner
"Como prioridad, configurar dns  considerando los requisitos de seguridad como parte de la iteración actual",Despliegue,Advanced
Desarrollar imagen de aplicación e integrarlo con el sistema existente usando Chef,Desarrollo,Beginner
Estimar  siguiendo los estándares establecidos manteniendo la compatibilidad con versiones anteriores durante esta quincena,Planificación,Beginner
"Como parte del sprint, crear framework de pruebas con GraphQL",Desarrollo,Advanced
Necesito revisión de progreso  en los próximos días,Reunión,Beginner
planificar navegación dashboard administrativo siguiendo la guía de estilos con zeplin y realizar pruebas unitarias,Diseño,Intermediate
Generar documentación técnica  para el proyecto,Documentación,Advanced
Necesito priorizar issues  asegurando la calidad del código como parte de la iteración actual,Testing,Advanced
Preparar release y documentar  siguiendo las mejores prácticas como parte de la iteración actual,Despliegue,Beginner
Tarea: Garantizar calidad ,Revisión,Advanced
Evaluar desempeño  para el proyecto manteniendo la compatibilidad con versiones anteriores,Revisión,Advanced
Tarea: Preparar manual  esta semana,Documentación,Beginner
Validar usabilidad  para el proyecto y realizar pruebas unitarias para la próxima release,Testing,Beginner
crear help center  siguiendo los estándares establecidos asegurando la calidad del código en los próximos días,Documentación,Beginner
Crear WBS  considerando los requisitos de seguridad para el próximo sprint,Planificación,Intermediate
Publicar versión y documentar  como parte de la iteración actual,Despliegue,Beginner
necesito validar cumplimiento  con documentación adecuada,Revisión,Advanced
gestionar configuración y documentar  con enfoque en performance,Despliegue,Beginner
Probar middleware de autenticación e integrarlo con el sistema existente usando Python con enfoque en performance,Desarrollo,Intermediate
"como prioridad, automatizar pruebas  considerando los requisitos de seguridad",Testing,Advanced
prioridad: instrumentar sistema de cache en flask asegurando la calidad del código,Desarrollo,Advanced
Definir KPIs  siguiendo los estándares establecidos manteniendo la compatibilidad con versiones anteriores en los próximos días,Planificación,Beginner
"Como prioridad, orquestar contenedores  en los próximos días",Despliegue,Beginner
Reunión de kickoff  con documentación adecuada en los próximos días,Reunión,Advanced
Valider funcionalidad y documentar  durante esta quincena,Testing,Advanced
"Como prioridad, preparar manual  para la entrega del sprint",Documentación,Beginner
automatizar despliegue  con enfoque en performance,Despliegue,Intermediate
Realizar pruebas unitarias  para el proyecto para la entrega del sprint para la próxima release,Testing,Advanced
balancear carga ,Planificación,Intermediate
Necesito encuentro ,Reunión,Intermediate
"Como prioridad, inspeccionar  asegurando la calidad del código",Revisión,Intermediate
Reviser documentación  para el proyecto,Documentación,Intermediate
"Como parte del sprint, integrar configuración de ambiente con Grafana asegurando la calidad del código",Desarrollo,Beginner
Probar rendimiento  siguiendo los estándares establecidos para la entrega del sprint,Testing,Intermediate
necesito garantizar calidad ,Revisión,Advanced
necesito coordinación  antes del viernes,Reunión,Beginner
"como prioridad, junta ",Reunión,Intermediate
hacer testing regresión ,Testing,Intermediate
"Como prioridad, automatizar pruebas ",Testing,Intermediate
"como perte del sprint, extender endpoint de pagos con rabbitmq y realizar pruebas unitarias",Desarrollo,Advanced
necesito validar cumplimiento ,Revisión,Beginner
"Como prioridad, briefing  con documentación adecuada",Reunión,Advanced
Necesito definir ui tooltips informativos para Portal de Autoservicio,Diseño,Advanced
Planificar navegación página de inicio que cumpla con estándares de accesibilidad usando Affinity Designer coordinando con el equipo en los próximos días,Diseño,Advanced
Planificación de sprint  para el proyecto manteniendo la compatibilidad con versiones anteriores,Reunión,Intermediate
"Como prioridad, sync  considerando los requisitos de seguridad esta semana",Reunión,Intermediate
Adaptar proceso batch e integrarlo con el sistema existente usando Linux coordinando con el equipo,Desarrollo,Intermediate
Tarea: Validar  en los próximos días,Testing,Beginner
Ejecutar pruebas integración y documentar ,Testing,Intermediate
"Como prioridad, reportar errores  asegurando la calidad del código",Testing,Beginner
Revisar código servicio de notificaciones con Puppet para Herramienta Interna y realizar pruebas unitarias,Desarrollo,Intermediate
Elaborer interfaz de usuario para mejorar la experiencia de usuario usando Photoshop manteniendo la compatibilidad con versiones anteriores durante esta quincena,Diseño,Beginner
"como prioridad, alinemento  con documentación adecuada para la próxima release",Reunión,Intermediate
Revisar y documentar ,Revisión,Advanced
rediseñar menús desplegables para sistema de diseño con axure,Diseño,Intermediate
Reunión  para el proyecto,Reunión,Beginner
Migrar middleware de autenticación e integrarlo con el sistema existente usando AWS en los próximos días,Desarrollo,Advanced
crear experiencia de usuario utilizando photoshop para el proyecto rediseño de plataforma y realizar pruebas unitarias antes del viernes,Diseño,Intermediate
Validar microservicio de catálogo en el proyecto GanttFlow usando Flask coordinando con el equipo para la próxima release,Desarrollo,Advanced
Maquetar design system usando zeplin siguiendo las mejores prácticas como parte de la iteración actual,Diseño,Beginner
necesito revisar seguridad  asegurando la calidad del código durante esta quincena,Revisión,Beginner
tarea: gestionar configuración  esta semana,Despliegue,Beginner
Preparar materiales entrenamiento  siguiendo los estándares establecidos para la entrega del sprint,Documentación,Intermediate
"Como prioridad, sesión de estrategia  asegurando la calidad del código",Reunión,Intermediate
necesito valider calidad  asegurando la calidad del código para la próxima release,Revisión,Beginner
necesito escalar infraestructura  considerando los requisitos de seguridad,Despliegue,Beginner
"Como prioridad, documentar  y realizar pruebas unitarias esta semana",Documentación,Intermediate
Lanzar  siguiendo los estándares establecidos y realizar pruebas unitarias antes del viernes,Despliegue,Beginner
Necesito asignar recursos  con documentación adecuada,Planificación,Advanced
Elaborar notificaciones toast para mejorar la experiencia de usuario usando CorelDRAW con documentación adecuada,Diseño,Advanced
Tarea: Optimizar plugin de navegador para Herramienta Interna asegurando la calidad del código como parte de la iteración actual,Desarrollo,Beginner
Redactar  para el proyecto,Documentación,Advanced
Necesito distribuir tareas  para el próximo sprint,Planificación,Beginner
diseñar sidebar colapsable que sea responsive usando zeplin siguiendo las mejores prácticas para la próxima release,Diseño,Advanced
Revisión  y realizar pruebas unitarias esta semana,Reunión,Beginner
"como prioridad, organizar ",Planificación,Advanced
Ejecutar pruebas y documentar  manteniendo la compatibilidad con versiones anteriores,Testing,Advanced
Mantener aplicación móvil con Elasticsearch para Sistema de Reportes y realizar pruebas unitarias,Desarrollo,Advanced
Elaborar logotipo moderno para mejorar la experiencia de usuario usando Illustrator,Diseño,Intermediate
Verificar bugs  con documentación adecuada para el próximo sprint,Testing,Beginner
Extender clase de utilidades en el proyecto API Gateway usando nginx asegurando la calidad del código,Desarrollo,Advanced
Prioridad: Integrar script de despliegue en TypeScript con documentación adecuada antes del viernes,Desarrollo,Beginner
tarea: probar  considerando los requisitos de seguridad,Testing,Beginner
Adaptar endpoint GraphQL en el proyecto Dashboard Analytics usando Apache manteniendo la compatibilidad con versiones anteriores antes del viernes,Desarrollo,Advanced
Tarea: ejecutar api restful para app móvil considerando los requisitos de seguridad,Desarrollo,Intermediate
Tarea: Elaborar tutorial ,Documentación,Advanced
Diseñar sistema de diseño que sea responsive usando gravit antes del viernes,Diseño,Advanced
Tarea: Priorizar  siguiendo las mejores prácticas durante esta quincena,Planificación,Advanced
Refactorizar paquete NPM con Express para Portal de Clientes asegurando la calidad del código,Desarrollo,Beginner
Creer ejemplos  para el proyecto asegurando la calidad del código,Documentación,Beginner
programar  siguiendo los estándares establecidos como parte de la iteración actual,Planificación,Advanced
"Como parte del sprint, desarrollar configuración de ambiente con RabbitMQ durante esta quincena",Desarrollo,Beginner
"Como prioridad, asegurar mejores prácticas  y realizar pruebas unitarias",Revisión,Beginner
indexar contenidos  siguiendo los estándares establecidos en los próximos días,Documentación,Intermediate
Evaluar  siguiendo los estándares establecidos durante esta quincena,Revisión,Intermediate
tarea: revisar documentación  y realizar pruebas unitarias para el próximo sprint,Revisión,Intermediate
"como prioridad, superviser  considerando los requisitos de seguridad",Revisión,Beginner
"como prioridad, estructurar  con documentación adecuada durante esta quincena",Planificación,Advanced
Calendarizar  para el proyecto manteniendo la compatibilidad con versiones anteriores,Planificación,Advanced
necesito analizar resultados  coordinando con el equipo,Testing,Intermediate
necesito valider usabilidad ,Testing,Advanced
necesito configurar balanceador ,Despliegue,Beginner
"Como prioridad, desplegar ",Despliegue,Advanced
Necesito definir kpis  durante esta quincena,Planificación,Beginner
Configurar balanceador  para el proyecto con enfoque en performance,Despliegue,Intermediate
Administrar clusters y documentar  siguiendo las mejores prácticas,Despliegue,Beginner
"Como prioridad, prober rendimiento  para la entrega del sprint antes del viernes",Testing,Beginner
Hacer deploy  siguiendo los estándares establecidos manteniendo la compatibilidad con versiones anteriores,Despliegue,Advanced
Presentación  siguiendo los estándares establecidos para la entrega del sprint,Reunión,Intermediate
Necesito analizar resultados  como parte de la iteración actual,Testing,Intermediate
necesito priorizar issues  manteniendo la compatibilidad con versiones anteriores como parte de la iteración actual,Testing,Intermediate
tarea: escribir  para la entrega del sprint,Documentación,Intermediate
definir kpis  para el proyecto manteniendo la compatibilidad con versiones anteriores,Planificación,Intermediate
Probar  para el proyecto,Testing,Intermediate
revisar pull request  y realizar pruebas unitarias,Revisión,Intermediate
Briefing  para el proyecto con documentación adecuada,Reunión,Advanced
Calendarizar  para el proyecto coordinando con el equipo,Planificación,Beginner
necesito establecer objetivos  asegurando la calidad del código como parte de la iteración actual,Planificación,Beginner
Elaborar formularios accesibles para mejorar la experiencia de usuario usando Figma siguiendo las mejores prácticas para la próxima release,Diseño,Intermediate
Tarea: Evaluar desempeño  y realizar pruebas unitarias en los próximos días,Revisión,Beginner
Indexar contenidos y documentar  para la próxima release,Documentación,Intermediate
Probar código microservicio de catálogo utilizando REST con documentación adecuada,Desarrollo,Beginner
workshop  siguiendo los estándares establecidos como parte de la iteración actual,Reunión,Advanced
aprobar cambios y documentar  considerando los requisitos de seguridad,Revisión,Beginner
tarea: crear guía  con documentación adecuada,Documentación,Advanced
Auditar  con documentación adecuada para la próxima release,Revisión,Intermediate
migrar parámetros de conexión utilizando git con enfoque en performance,Desarrollo,Intermediate
revisar código proceso batch utilizando jenkins coordinando con el equipo en los próximos días,Desarrollo,Advanced
Tarea: Hacer deploy  para el próximo sprint,Despliegue,Advanced
Presentación ,Reunión,Advanced
Sync y documentar  considerando los requisitos de seguridad para el próximo sprint,Reunión,Beginner
evaluar accesibilidad wireframe de navegación siguiendo la guía de estilos con illustrator con documentación adecuada para la próxima release,Diseño,Intermediate
Tarea: Secuenciar  esta semana,Planificación,Advanced
prioridad: mejorar servicio web soap en grafana para el próximo sprint,Desarrollo,Intermediate
Sesión de estrategia y documentar ,Reunión,Beginner
Revisar documentación  siguiendo los estándares establecidos y realizar pruebas unitarias para el próximo sprint,Documentación,Beginner
Evaluar desempeño y documentar  en los próximos días,Revisión,Advanced
ejecutar tests y documentar  siguiendo las mejores prácticas,Testing,Intermediate
Asegurar estándares y documentar ,Revisión,Intermediate
Evaluar desempeño  con enfoque en performance,Revisión,Beginner
debriefing  siguiendo los estándares establecidos coordinando con el equipo,Reunión,Intermediate
necesito solucionar aplicación móvil con linux manteniendo la compatibilidad con versiones anteriores,Desarrollo,Intermediate
necesito ejecutar pruebas integración  considerando los requisitos de seguridad durante esta quincena,Testing,Beginner
"Como prioridad, hacer deploy  con documentación adecuada",Despliegue,Beginner
necesito publicar  esta semana,Despliegue,Advanced
tarea: revisar documentación  como parte de la iteración actual,Revisión,Intermediate
Asegurar estándares ,Revisión,Intermediate
Tarea: realizar release  con documentación adecuada,Despliegue,Beginner
Necesito validar ,Testing,Intermediate
Necesito sesión  esta semana,Reunión,Advanced
Preparar ambiente producción y documentar  como parte de la iteración actual,Despliegue,Advanced
Crear prototipo design system siguiendo la guía de estilos con Proto.io con enfoque en performance,Diseño,Intermediate
Medir cobertura  y realizar pruebas unitarias,Testing,Intermediate
crear guía  siguiendo los estándares establecidos con enfoque en performance,Documentación,Beginner
Escribir especificaciones y documentar ,Documentación,Advanced
Elaborar landing page conversiva para mejorar la experiencia de usuario usando Sketch para la entrega del sprint como parte de la iteración actual,Diseño,Advanced
Necesito traducir documentación  con documentación adecuada,Documentación,Advanced
"Como prioridad, gestionar riesgos  manteniendo la compatibilidad con versiones anteriores para el próximo sprint",Planificación,Intermediate
Necesito estructurar  para la próxima release,Planificación,Beginner
Planificar y documentar  considerando los requisitos de seguridad,Planificación,Intermediate
Integrar extensión de IDE utilizando nginx durante esta quincena,Desarrollo,Beginner
Workshop  para el proyecto,Reunión,Beginner
Adaptar herramienta de desarrollo utilizando Java y realizar pruebas unitarias esta semana,Desarrollo,Intermediate
probar api de usuarios e integrarlo con el sistema existente usando postgresql con documentación adecuada en los próximos días,Desarrollo,Advanced
Optimizar flujos menús desplegables que cumpla con estándares de accesibilidad usando lunacy siguiendo las mejores prácticas,Diseño,Beginner
Coordiner con desarrollo sidebar colapsable para Nueva Identidad Visual con Principle manteniendo la compatibilidad con versiones anteriores para el próximo sprint,Diseño,Advanced
tarea: solucionar daemon de monitoreo para app móvil en los próximos días,Desarrollo,Intermediate
Diseñar interfaz logotipo moderno siguiendo la guía de estilos con CorelDRAW esta semana,Diseño,Intermediate
prioridad: actualizar microservicio de inventario en express durante esta quincena,Desarrollo,Advanced
Secuenciar  para el proyecto antes del viernes,Planificación,Beginner
Necesito revisar documentación  antes del viernes,Revisión,Advanced
Crear guía  siguiendo los estándares establecidos,Documentación,Intermediate
Lanzar y documentar  coordinando con el equipo,Despliegue,Advanced
Maquetar design system para dashboard de analytics con lunacy,Diseño,Intermediate
"Como prioridad, coordinación interdepertamental  asegurando la calidad del código",Reunión,Beginner
"como prioridad, escribir  con enfoque en performance",Documentación,Beginner
Secuenciar y documentar  asegurando la calidad del código,Planificación,Beginner
"Como prioridad, actualizer documentación  considerando los requisitos de seguridad",Documentación,Beginner
mantener extensión de ide con elasticsearch para herramienta interna asegurando la calidad del código durante esta quincena,Desarrollo,Beginner
Actualizar y optimizar componente UI para mejor rendimiento en Kubernetes para la próxima release,Desarrollo,Advanced
Ajustar cronograma  para el proyecto,Planificación,Intermediate
implementar módulo de analytics con node.js para sistema de gestión siguiendo las mejores prácticas,Desarrollo,Advanced
"Como prioridad, reunión  considerando los requisitos de seguridad",Reunión,Intermediate
Escribir instrucciones  con documentación adecuada,Documentación,Beginner
Tarea: Sesión de estrategia  siguiendo las mejores prácticas,Reunión,Intermediate
sesión de estrategia  manteniendo la compatibilidad con versiones anteriores antes del viernes,Reunión,Advanced
escribir ,Documentación,Beginner
Controlar calidad y documentar  antes del viernes,Revisión,Advanced
Seguimiento y documentar  con enfoque en performance,Reunión,Beginner
Necesito calendarizar  con documentación adecuada,Planificación,Advanced
Tarea: Validar ,Testing,Intermediate
"como prioridad, verificar bugs  para la entrega del sprint en los próximos días",Testing,Beginner
Indexar contenidos y documentar  asegurando la calidad del código,Documentación,Advanced
Necesito optimizar suite  con enfoque en performance,Testing,Beginner
valider calidad  siguiendo los estándares establecidos manteniendo la compatibilidad con versiones anteriores esta semana,Revisión,Beginner
"Como prioridad, preparar release  para la entrega del sprint como parte de la iteración actual",Despliegue,Beginner
Crear guía de estilos gráficos informativos usando Sketch con documentación adecuada,Diseño,Intermediate
tarea: reunión de cierre  manteniendo la compatibilidad con versiones anteriores,Reunión,Advanced
Planear y documentar  durante esta quincena,Planificación,Advanced
Necesito distribuir tareas ,Planificación,Beginner
Revisar documentación y documentar ,Documentación,Beginner
crear wbs  antes del viernes,Planificación,Advanced
evaluar  siguiendo los estándares establecidos y realizar pruebas unitarias,Revisión,Beginner
Coordinar con desarrollo tipografía corporativa siguiendo la guía de estilos con Figma,Diseño,Advanced
Escribir manual usuario y documentar  siguiendo las mejores prácticas para la próxima release,Documentación,Beginner
Necesito evaluar arquitectura  y realizar pruebas unitarias,Revisión,Beginner
Validar calidad  siguiendo los estándares establecidos durante esta quincena,Revisión,Intermediate
Necesito solucionar endpoint graphql con prometheus para la próxima release,Desarrollo,Intermediate
"Como prioridad, configurar balanceador  con enfoque en performance para el próximo sprint",Despliegue,Beginner
Crear mockups sidebar colapsable usando Lunacy para la próxima release,Diseño,Advanced
necesito extender paquete npm con graphql y realizar pruebas unitarias,Desarrollo,Intermediate
Diseñar iconos botones interactivos siguiendo la guía de estilos con Zeplin para la próxima release,Diseño,Intermediate
necesito validar funcionalidad  coordinando con el equipo,Testing,Beginner
Extender componente UI en el proyecto Plataforma E-commerce usando Grafana considerando los requisitos de seguridad,Desarrollo,Advanced
Medir cobertura  para el próximo sprint,Testing,Advanced
Tarea: Revisar documentación  durante esta quincena,Revisión,Advanced
crear api de usuarios con sqlite para plataforma educativa manteniendo la compatibilidad con versiones anteriores para la próxima release,Desarrollo,Intermediate
diseñar layout sistema de diseño que cumpla con estándares de accesibilidad usando figma esta semana,Diseño,Advanced
Ejecutar pruebas y documentar  con enfoque en performance,Testing,Advanced
Necesito optimizar suite  coordinando con el equipo,Testing,Beginner
publicar versión  siguiendo los estándares establecidos antes del viernes,Despliegue,Beginner
Definir roadmap  siguiendo los estánderes establecidos considerando los requisitos de seguridad,Planificación,Advanced
Necesito maquetar branding consistente para Rediseño de Plataforma siguiendo las mejores prácticas esta semana,Diseño,Advanced
tarea: presentación  siguiendo las mejores prácticas para la próxima release,Reunión,Beginner
validar cumplimiento  siguiendo los estándares establecidos como parte de la iteración actual,Revisión,Advanced
Corregir algoritmo de recomendación en el proyecto Plataforma Educativa usando Flask manteniendo la compatibilidad con versiones anteriores,Desarrollo,Intermediate
reunión  con documentación adecuada,Reunión,Intermediate
Monitorear ambiente de staging e integrarlo con el sistema existente usando Java con enfoque en performance,Desarrollo,Beginner
Escribir  con documentación adecuada,Documentación,Advanced
necesito sesión  manteniendo la compatibilidad con versiones anteriores en los próximos días,Reunión,Advanced
definir hitos y documentar ,Planificación,Advanced
Configurar endpoint GraphQL e integrarlo con el sistema existente usando Kubernetes para la entrega del sprint para la próxima release,Desarrollo,Beginner
"Como prioridad, validar  en los próximos días",Testing,Beginner
Tarea: Crear plan trabajo ,Planificación,Intermediate
Publicar  siguiendo los estándares establecidos manteniendo la compatibilidad con versiones anteriores para el próximo sprint,Despliegue,Intermediate
alinemento  siguiendo los estánderes establecidos siguiendo las mejores prácticas,Reunión,Intermediate
necesito construir endpoint graphql con grafana y realizar pruebas unitarias,Desarrollo,Advanced
